<!ELEMENT hotels (hotel)+>
<!ELEMENT hotel (id, imatge, categoria, nom, lloc, preu)>
<!ELEMENT id (#PCDATA)>
<!ELEMENT imatge (#PCDATA)>
<!ELEMENT categoria (#PCDATA)>
<!ELEMENT nom (#PCDATA)>
<!ELEMENT lloc (#PCDATA)>
<!ELEMENT preu (#PCDATA)>

<!ATTLIST hotel idprod ID #REQUIRED>